{
  "schema_version": 2,
  "profile_set_id": "english_course_level_exit_profiles",
  "version": 1,
  "status": "approved",
  "exit_levels": [
    "a1",
    "a2",
    "b1",
    "b2",
    "c1",
    "c2"
  ],
  "onboarding_support": {
    "level": "pre_a1",
    "role": "Diagnostic and remedial on-ramp for isolated words, formulaic expressions, and foundational recognition.",
    "exit_claim": false
  },
  "internal_milestones": [
    {
      "id": "a2_plus",
      "gse_range": "36-42",
      "role": "Internal progress milestone within the A2-to-B1 journey."
    },
    {
      "id": "b1_plus",
      "gse_range": "51-58",
      "role": "Internal progress milestone within the B1-to-B2 journey."
    },
    {
      "id": "b2_plus",
      "gse_range": "67-75",
      "role": "Internal progress milestone within the B2-to-C1 journey."
    }
  ],
  "lifecycle": [
    "expose",
    "introduce",
    "practise",
    "recycle",
    "consolidate",
    "extend"
  ],
  "evidence_bundles": {
    "path": "data/reviewed/level-exit-evidence-v1.json",
    "sha256": "b4dbb6d279cf0237b123d460106fce3b65a9e0bda75a8d455f259fdb4e2d84b6"
  },
  "levels": [
    {
      "level": "a1",
      "progression_index": 1,
      "gse_range": "22-29",
      "title": "Supported concrete communication",
      "exit_promise": {
        "claim_id": "a1.exit_promise",
        "claim_type": "synthesis",
        "text": "Handle concrete personal details and immediate needs with learnt language and a collaborative partner.",
        "evidence_bundle_ids": [
          "cefr_all_descriptors.a1.listening_reception",
          "cefr_all_descriptors.a1.mediation",
          "cefr_all_descriptors.a1.oral_interaction",
          "cefr_all_descriptors.a1.reading_reception",
          "cefr_all_descriptors.a1.speaking_production",
          "cefr_all_descriptors.a1.writing_production",
          "cefr_all_descriptors.a1.written_online_interaction",
          "gse_all_objectives.a1.listening_reception",
          "gse_all_objectives.a1.reading_reception",
          "gse_all_objectives.a1.speaking_production",
          "gse_all_objectives.a1.writing_production"
        ],
        "decision_refs": [
          "docs/CROSS_LEVEL_CURRICULUM_ARCHITECTURE.md#supported-progression"
        ],
        "review": {
          "status": "accepted",
          "reviewer": "codex_primary_curriculum_agent",
          "reviewed_at": "2026-08-10T12:54:12+03:00"
        }
      },
      "reception": {
        "listening": {
          "claim_id": "a1.reception.listening",
          "claim_type": "source_boundary",
          "text": "Recognise familiar words and very basic phrases when delivery is slow, clear, and context-supported.",
          "evidence_bundle_ids": [
            "cefr_all_descriptors.a1.listening_reception",
            "gse_all_objectives.a1.listening_reception"
          ],
          "decision_refs": [],
          "review": {
            "status": "accepted",
            "reviewer": "codex_primary_curriculum_agent",
            "reviewed_at": "2026-08-10T12:54:12+03:00"
          }
        },
        "reading": {
          "claim_id": "a1.reception.reading",
          "claim_type": "source_boundary",
          "text": "Understand familiar names, words, signs, and very simple sentences in predictable material.",
          "evidence_bundle_ids": [
            "cefr_all_descriptors.a1.reading_reception",
            "gse_all_objectives.a1.reading_reception"
          ],
          "decision_refs": [],
          "review": {
            "status": "accepted",
            "reviewer": "codex_primary_curriculum_agent",
            "reviewed_at": "2026-08-10T12:54:12+03:00"
          }
        }
      },
      "production": {
        "speaking": {
          "claim_id": "a1.production.speaking",
          "claim_type": "source_boundary",
          "text": "Use isolated simple phrases and sentences for personal details, familiar people, places, possessions, and needs.",
          "evidence_bundle_ids": [
            "cefr_all_descriptors.a1.speaking_production",
            "gse_all_objectives.a1.speaking_production"
          ],
          "decision_refs": [],
          "review": {
            "status": "accepted",
            "reviewer": "codex_primary_curriculum_agent",
            "reviewed_at": "2026-08-10T12:54:12+03:00"
          }
        },
        "writing": {
          "claim_id": "a1.production.writing",
          "claim_type": "source_boundary",
          "text": "Produce isolated phrases and sentences and complete very simple personal-detail forms or messages.",
          "evidence_bundle_ids": [
            "cefr_all_descriptors.a1.writing_production",
            "gse_all_objectives.a1.writing_production"
          ],
          "decision_refs": [],
          "review": {
            "status": "accepted",
            "reviewer": "codex_primary_curriculum_agent",
            "reviewed_at": "2026-08-10T12:54:12+03:00"
          }
        }
      },
      "interaction": {
        "oral": {
          "claim_id": "a1.interaction.oral",
          "claim_type": "source_boundary",
          "text": "Ask and answer simple questions with repetition, rephrasing, slower speech, and formulation help.",
          "evidence_bundle_ids": [
            "cefr_all_descriptors.a1.oral_interaction"
          ],
          "decision_refs": [],
          "review": {
            "status": "accepted",
            "reviewer": "codex_primary_curriculum_agent",
            "reviewed_at": "2026-08-10T12:54:12+03:00"
          }
        },
        "written_online": {
          "claim_id": "a1.interaction.written_online",
          "claim_type": "source_boundary",
          "text": "Post simple greetings or reactions and complete a very simple purchase or personal-details form.",
          "evidence_bundle_ids": [
            "cefr_all_descriptors.a1.written_online_interaction"
          ],
          "decision_refs": [],
          "review": {
            "status": "accepted",
            "reviewer": "codex_primary_curriculum_agent",
            "reviewed_at": "2026-08-10T12:54:12+03:00"
          }
        },
        "mediation": {
          "claim_id": "a1.interaction.mediation",
          "claim_type": "source_boundary",
          "text": "Relay simple predictable information from short signs or notices and show welcome, interest, or understanding.",
          "evidence_bundle_ids": [
            "cefr_all_descriptors.a1.mediation"
          ],
          "decision_refs": [],
          "review": {
            "status": "accepted",
            "reviewer": "codex_primary_curriculum_agent",
            "reviewed_at": "2026-08-10T12:54:12+03:00"
          }
        }
      },
      "language_control": {
        "range": {
          "claim_id": "a1.language_control.range",
          "claim_type": "source_boundary",
          "text": "Very basic expressions and some one-clause structures for concrete personal information and needs.",
          "evidence_bundle_ids": [
            "cefr_all_descriptors.a1.language_range"
          ],
          "decision_refs": [],
          "review": {
            "status": "accepted",
            "reviewer": "codex_primary_curriculum_agent",
            "reviewed_at": "2026-08-10T12:54:12+03:00"
          }
        },
        "grammar": {
          "claim_id": "a1.language_control.grammar",
          "claim_type": "source_boundary",
          "text": "Limited control of a few learnt simple structures and sentence patterns.",
          "evidence_bundle_ids": [
            "cefr_all_descriptors.a1.grammar",
            "egp_all_levels.a1.grammar",
            "gse_grammar_all.a1.grammar"
          ],
          "decision_refs": [],
          "review": {
            "status": "accepted",
            "reviewer": "codex_primary_curriculum_agent",
            "reviewed_at": "2026-08-10T12:54:12+03:00"
          }
        },
        "vocabulary": {
          "claim_id": "a1.language_control.vocabulary",
          "claim_type": "source_boundary",
          "text": "Basic words and phrases tied to particular concrete situations.",
          "evidence_bundle_ids": [
            "cefr_all_descriptors.a1.vocabulary",
            "oxford_3000_all.a1.lexical_pool"
          ],
          "decision_refs": [],
          "review": {
            "status": "accepted",
            "reviewer": "codex_primary_curriculum_agent",
            "reviewed_at": "2026-08-10T12:54:12+03:00"
          }
        },
        "pronunciation": {
          "claim_id": "a1.language_control.pronunciation",
          "claim_type": "source_boundary",
          "text": "A limited learnt repertoire is intelligible with effort and collaborative support.",
          "evidence_bundle_ids": [
            "cefr_all_descriptors.a1.pronunciation"
          ],
          "decision_refs": [],
          "review": {
            "status": "accepted",
            "reviewer": "codex_primary_curriculum_agent",
            "reviewed_at": "2026-08-10T12:54:12+03:00"
          }
        },
        "discourse": {
          "claim_id": "a1.language_control.discourse",
          "claim_type": "source_boundary",
          "text": "Link words or groups mainly with very basic linear connectors such as and or then.",
          "evidence_bundle_ids": [
            "cefr_all_descriptors.a1.discourse"
          ],
          "decision_refs": [],
          "review": {
            "status": "accepted",
            "reviewer": "codex_primary_curriculum_agent",
            "reviewed_at": "2026-08-10T12:54:12+03:00"
          }
        },
        "fluency": {
          "claim_id": "a1.language_control.fluency",
          "claim_type": "source_boundary",
          "text": "Manage very short pre-packaged utterances with substantial pausing and repair.",
          "evidence_bundle_ids": [
            "cefr_all_descriptors.a1.fluency"
          ],
          "decision_refs": [],
          "review": {
            "status": "accepted",